{
  "calibration": {
    "method": "leave_one_site_out_nearest_neighbour",
    "per_site": [
      {
        "max": 0.37245343238321926,
        "n": 20,
        "p50": 0.12407821179770467,
        "p95": 0.32289013432929253,
        "site_id": "ind_D2"
      },
      {
        "max": 0.4129009938318786,
        "n": 20,
        "p50": 0.18661287366259177,
        "p95": 0.3828646370843531,
        "site_id": "ind_D3"
      },
      {
        "max": 0.35128007993165467,
        "n": 20,
        "p50": 0.16482373384966403,
        "p95": 0.34684697188522257,
        "site_id": "ind_H4"
      },
      {
        "max": 0.24874208583629775,
        "n": 20,
        "p50": 0.11685913856608399,
        "p95": 0.19813329603614827,
        "site_id": "ind_N1"
      },
      {
        "max": 0.3701503460837634,
        "n": 20,
        "p50": 0.2123109434322618,
        "p95": 0.30192014009115786,
        "site_id": "ken_H1"
      }
    ],
    "percentile": 95,
    "pooled_n": 100
  },
  "embedding_model": {
    "dimension": 1280,
    "name": "surfperch",
    "version": "1.0"
  },
  "embedding_space_note": "The reference rows are the 100 training windows (first 5 s window of each training file) embedded through reef_audio by the deployed SurfPerch container, the same space as served windows. The distance measures how far a recording's windows are from the training recordings: 1 minus the largest cosine to any training window. The threshold is the 95th percentile of leave-one-site-out distances, so it describes how far an unseen site's windows typically are from the other sites. It cannot detect whether the classifier matches its embedding space (05-RESEARCH Pitfall 8), and it never changes a class probability.",
  "embeddings": {
    "count": 100,
    "dim": 1280,
    "dtype": "float32-le",
    "sha256": "74123a44555181c7fb8cbe3a1340d72dc65df8ad4abdbafe0aedf64a5d5712e2",
    "uri": "v2/ood_reference.f32"
  },
  "k": 1,
  "metric": "cosine_distance",
  "ood_version": "ood-2026.10.1-nn1-cosine",
  "preprocessing_spec_version": "preproc-2026.10.1-reef-audio",
  "row_site_ids": [
    "ind_D2",
    "ind_D2",
    "ind_D2",
    "ind_D2",
    "ind_D2",
    "ind_D2",
    "ind_D2",
    "ind_D2",
    "ind_D2",
    "ind_D2",
    "ind_D3",
    "ind_D3",
    "ind_D3",
    "ind_D3",
    "ind_D3",
    "ind_D3",
    "ind_D3",
    "ind_D3",
    "ind_D3",
    "ind_D3",
    "ind_D3",
    "ind_D3",
    "ind_D3",
    "ind_D3",
    "ind_D3",
    "ind_D3",
    "ind_D3",
    "ind_D3",
    "ind_D3",
    "ind_D3",
    "ind_H4",
    "ind_H4",
    "ind_H4",
    "ind_H4",
    "ind_H4",
    "ind_H4",
    "ind_H4",
    "ind_H4",
    "ind_H4",
    "ind_H4",
    "ind_D2",
    "ind_D2",
    "ind_D2",
    "ind_D2",
    "ind_D2",
    "ind_D2",
    "ind_D2",
    "ind_D2",
    "ind_D2",
    "ind_D2",
    "ind_N1",
    "ind_N1",
    "ind_N1",
    "ind_N1",
    "ind_N1",
    "ind_N1",
    "ind_N1",
    "ind_N1",
    "ind_N1",
    "ind_N1",
    "ind_N1",
    "ind_N1",
    "ind_N1",
    "ind_N1",
    "ind_N1",
    "ind_N1",
    "ind_N1",
    "ind_N1",
    "ind_N1",
    "ind_N1",
    "ind_H4",
    "ind_H4",
    "ind_H4",
    "ind_H4",
    "ind_H4",
    "ind_H4",
    "ind_H4",
    "ind_H4",
    "ind_H4",
    "ind_H4",
    "ken_H1",
    "ken_H1",
    "ken_H1",
    "ken_H1",
    "ken_H1",
    "ken_H1",
    "ken_H1",
    "ken_H1",
    "ken_H1",
    "ken_H1",
    "ken_H1",
    "ken_H1",
    "ken_H1",
    "ken_H1",
    "ken_H1",
    "ken_H1",
    "ken_H1",
    "ken_H1",
    "ken_H1",
    "ken_H1"
  ],
  "schema_version": 1,
  "source_inputs": [
    {
      "path": "models/interim-real-only/evaluation/inputs/reembedded.f32",
      "sha256": "74123a44555181c7fb8cbe3a1340d72dc65df8ad4abdbafe0aedf64a5d5712e2"
    },
    {
      "path": "models/interim-real-only/evaluation/inputs/reembedded.json",
      "sha256": "d5f75b9d264455548cad7bcf523a7cfab8003837fbea9da127491b77a2eeeb31"
    },
    {
      "path": "models/interim-real-only/evaluation/inputs/rows.json",
      "sha256": "dc939d955d69a9f0e9d483c6f37a3770666d1cc88e8d8cedcc846f2e34dfb392"
    }
  ],
  "threshold": 0.3519042294670288
}
